question,votes,tags
Python Sets vs Lists,253,python list performance data-structures set
Find unique rows in numpy.array,253,python arrays numpy unique
I'm getting Key error in python,253,python dictionary
How to find which columns contain any NaN value in Pandas dataframe,253,python pandas dataframe nan
How to use XPath in Python?,253,python xml dom xpath python-2.x
Skip first entry in for loop in python?,252,python
Passing HTML to template using Flask/Jinja2,252,python jinja2 flask
Converting integer to binary in python,252,python binary integer
"Class method differences in Python: bound, unbound and static",252,python static-methods
How to join two generators in Python?,252,python generator
How to step through Python code to help debug issues?,252,python debugging
Replacing blank values (white space) with NaN in pandas,252,python pandas dataframe
Concatenate a list of pandas dataframes together,252,python pandas dataframe concat
Python script to copy text to clipboard [duplicate],252,python clipboard pyperclip
How to convert integer timestamp into a datetime,252,python datetime timestamp
How to convert a NumPy array to PIL image applying matplotlib colormap,252,python numpy matplotlib python-imaging-library color-mapping
How does Django's nested Meta class work?,252,python django
Type hint for a file or file-like object?,252,python type-hinting
Compute list difference,251,python list
Using a dictionary to count the items in a list,251,python list count histogram
How to check for valid email address? [duplicate],251,python regex email-validation email-address
Remove duplicate dict in list in Python,251,python list dictionary
Create dynamic URLs in Flask with url_for(),251,python flask
Which Python packages offer a stand-alone event system? [closed],251,python events event-handling dispatcher
Executing multi-line statements in the one-line command-line,251,python shell command-line heredoc
How can I convert a dictionary into a list of tuples?,251,python list dictionary
matplotlib: how to draw a rectangle on image,251,python image matplotlib
Mocking python function based on input arguments,251,python unit-testing mocking mockito
Make virtualenv inherit specific packages from your global site-packages,251,python virtualenv
Scraping: SSL: CERTIFICATE_VERIFY_FAILED error for http://en.wikipedia.org,250,python web-scraping beautifulsoup scrapy ssl-certificate
How to check if a string in Python is in ASCII?,250,python string unicode ascii
"From list of integers, get number closest to a given value",250,python list sorting integer
Save classifier to disk in scikit-learn,250,python machine-learning scikit-learn classification
How to find the mime type of a file in python?,250,python mime
How to pass arguments to a Button command in Tkinter?,250,python python-3.x button tkinter arguments
pandas GroupBy columns with NaN (missing) values,250,python pandas group-by pandas-groupby nan
What's the function like sum() but for multiplication? product()?,250,python product built-in pep
Unpacking a list / tuple of pairs into two lists / tuples [duplicate],250,python list tuples
Formatting floats without trailing zeros,250,python formatting floating-point pretty-print
e.printStackTrace equivalent in python,250,python exception stack-trace
List of lists into numpy array,250,python list numpy
Queue.Queue vs. collections.deque,250,python queue thread-safety python-multithreading deque
Why isn't my Pandas 'apply' function referencing multiple columns working? [closed],250,python python-2.7 pandas dataframe apply
Python 3 turn range to a list,250,python python-3.x list range
How do I check (at runtime) if one class is a subclass of another?,250,python subclass assert
How do I pass a method as a parameter in Python,250,python parameter-passing
How to check if a Python module exists without importing it,250,python python-import
"Why can a function modify some arguments as perceived by the caller, but not others?",250,python
ImportError: No module named sklearn.cross_validation,249,python scikit-learn
How to output a comma delimited list in jinja python template?,249,python jinja2
Applying function with multiple arguments to create a new pandas column,249,python pandas
Python import csv to list [duplicate],249,python csv
How do I convert this list of dictionaries to a csv file?,249,python csv dictionary data-conversion
sqlalchemy unique across multiple columns,249,python sqlalchemy
Is there a zip-like function that pads to longest length?,249,python list zip
How to print a percentage value in python?,248,python python-2.x
Set Matplotlib colorbar size to match graph,248,python image matplotlib
Format / Suppress Scientific Notation from Pandas Aggregation Results,248,python pandas floating-point scientific-notation number-formatting
How to obtain a Thread id in Python?,248,python multithreading python-multithreading python-logging
Broken references in Virtualenvs,248,python macos virtualenv homebrew dyld
Windows path in Python,248,python path string-literals
pip: force install ignoring dependencies,248,python pip
"What are ""first-class"" objects?",248,python language-agnostic
"What's the proper way to install pip, virtualenv, and distribute for Python?",248,python virtualenv setuptools distribute
What is the difference between Python and IPython?,248,python ipython
How to get a complete list of object's methods and attributes? [duplicate],248,python
How can I print bold text in Python?,247,python text printing
"""RuntimeError: Make sure the Graphviz executables are on your system's path"" after installing Graphviz 2.38",247,python installation graphviz
Pandas dataframe fillna() only some columns in place,247,python pandas dataframe
Serializing class instance to JSON [duplicate],247,python json serialization pickle
Proxies with Python 'Requests' module,247,python python-requests httprequest http-proxy
Writing Unicode text to a text file?,247,python unicode character-encoding python-2.x
How can I list the contents of a directory in Python?,247,python path
AttributeError: 'module' object has no attribute [duplicate],247,python attributeerror
Find the unique values in a column and then sort them,247,python pandas sorting dataframe unique
Is it possible to use argsort in descending order?,247,python numpy
Can I serve multiple clients using just Flask app.run() as standalone?,247,python flask
warning about too many open figures,247,python python-3.x matplotlib
"sklearn error ValueError: Input contains NaN, infinity or a value too large for dtype('float64')",247,python python-2.7 scikit-learn valueerror
How can I check for Python version in a program that uses new language features?,247,python version
What's the correct way to sort Python `import x` and `from x import y` statements?,247,python coding-style python-import pep8
Python logging: use milliseconds in time format,246,python logging time
Changing a specific column name in pandas DataFrame [duplicate],246,python pandas
Set up Python simpleHTTPserver on Windows [duplicate],246,python windows python-3.x simplehttpserver
Dynamic instantiation from string name of a class in dynamically imported module?,246,python
How to run an .ipynb Jupyter Notebook from terminal?,246,python jupyter-notebook ipython nbconvert
How to filter rows in pandas by regex,246,python regex pandas
Using Sphinx with Markdown instead of reST,246,python markdown python-sphinx
How to set xlim and ylim for a subplot [duplicate],246,python matplotlib plot subplot
"What is the difference between pyenv, virtualenv, anaconda?",246,python pip anaconda virtualenv pyenv
Repeat string to certain length,245,string python repeat
Print all properties of a Python Class [duplicate],245,python oop
How do I check if there are duplicates in a flat list?,245,python string list duplicates
Understanding generators in Python,245,python generator
ImportError: No module named 'django.core.urlresolvers',245,python python-3.x django python-3.5 django-2.0
Print all day-dates between two dates [duplicate],245,python datetime
How can I use a conditional expression (expression with if and else) in a list comprehension? [duplicate],245,python list-comprehension conditional-operator
How to do a less than or equal to filter in Django queryset?,245,python django django-queryset
How do I get python's pprint to return a string instead of printing?,245,python pretty-print pprint
np.mean() vs np.average() in Python NumPy?,245,python numpy statistics average mean
How to delete last item in list?,244,python time python-3.x
How do I create a slug in Django?,244,python django django-models slug
How do I keep Python print from adding newlines or spaces? [duplicate],244,python printing formatting python-2.x
Initialise a list to a specific length in Python [duplicate],244,python list
How to preserve timezone when parsing date/time strings with strptime()?,244,python datetime timezone
List of unique dictionaries,244,python dictionary
Find column whose name contains a specific string,244,python python-3.x string pandas dataframe
Pandas dataframe get first row of each group,244,python pandas dataframe group-by row
How to choose an AWS profile when using boto3 to connect to CloudFront,244,python amazon-web-services boto3 amazon-iam amazon-cloudfront
Logging uncaught exceptions in Python,244,python logging exception-handling
How to deep copy a list?,244,python list copy deep-copy
Stop pip from failing on single package when installing with requirements.txt,244,python pip
"In Python, how do I indicate I'm overriding a method?",244,python inheritance overriding self-documenting-code
pass **kwargs argument to another function with **kwargs,244,python
"How to use ""/"" (directory separator) in both Linux and Windows in Python?",243,python linux windows unix
How can I print variable and string on same line in Python?,243,python string variables printing
Pandas get topmost n records within each group,243,python pandas group-by greatest-n-per-group window-functions
Turn Pandas Multi-Index into column,243,python pandas dataframe flatten multi-index
Python UTC datetime object's ISO format doesn't include Z (Zulu or Zero offset),243,python python-2.7 datetime timestamp iso8601
Why does Python's hash of infinity have the digits of π?,243,python math hash floating-point pi
Scoping in Python 'for' loops,243,python scope
Pinging servers in Python,242,python python-3.x ping icmp
django test app error - Got an error creating the test database: permission denied to create database,242,python sql django postgresql django-testing
Why does this iterative list-growing code give IndexError: list assignment index out of range? How can I repeatedly add (append) elements to a list?,242,python list exception
Anaconda export Environment file,242,python python-3.x anaconda conda
"django MultiValueDictKeyError error, how do I deal with it",242,python django exception
How to implement common bash idioms in Python? [closed],242,python bash shell
Getting individual colors from a color map in matplotlib,242,python matplotlib colors
Why does this code for initializing a list of lists apparently link the lists together? [duplicate],242,python list
assertEquals vs. assertEqual in python,242,python unit-testing
Django - makemigrations - No changes detected,241,python django django-migrations
Replacing Pandas or Numpy Nan with a None to use with MysqlDB,241,python pandas numpy mysql-python
Round to 5 (or other number) in Python,241,python rounding
How do I remove leading whitespace in Python?,241,python string whitespace trim
"Java ""Virtual Machine"" vs. Python ""Interpreter"" parlance?",241,java python jvm
Pythonic way to check if a file exists? [duplicate],241,python file
Concatenate a NumPy array to another NumPy array,241,python numpy
import module from string variable,241,python matplotlib
Why can't Python's raw string literals end with a single backslash?,241,python string literals rawstring
How to get exit code when using Python subprocess communicate method?,241,python subprocess
What are some good Python ORM solutions? [closed],241,python orm
matplotlib Legend Markers Only Once,241,python matplotlib
Which is faster in Python: x**.5 or math.sqrt(x)?,241,python performance
Is there a library function for Root mean square error (RMSE) in python?,240,python scikit-learn scipy
Counting unique values in a column in pandas dataframe like in Qlik?,240,python pandas numpy qlikview qliksense
error: command 'gcc' failed with exit status 1 while installing eventlet,240,python ubuntu eventlet
Multiple aggregations of the same column using pandas GroupBy.agg(),240,python pandas dataframe aggregate pandas-groupby
Dictionary: Get list of values for list of keys,240,python list dictionary key
Identifying the dependency relationship for python packages installed with pip,240,python pip
How to send an email with Python?,240,python email function smtplib
Parsing HTML using Python,240,python xml-parsing html-parsing
Programmatically saving image to Django ImageField,240,python django django-models
Python creating a dictionary of lists,240,python dictionary
Cannot install Lxml on Mac OS X 10.9,239,python xcode macos scrapy lxml
Common xlabel/ylabel for matplotlib subplots,239,python matplotlib
How can I extract all values from a dictionary in Python?,239,python dictionary extract
Create a .csv file with values from a Python list,239,python csv xlrd
Drop all duplicate rows across multiple columns in Python Pandas,239,python pandas duplicates drop-duplicates
Different ways of clearing lists,239,python list
How to create a dictionary of two pandas DataFrame columns,239,python dictionary pandas dataframe
How to modify list entries during for loop?,239,python
"Pandas column of lists, create a row for each list element",239,python pandas list
"SQLAlchemy: engine, connection and session difference",239,python session orm sqlalchemy psycopg2
Python void return type annotation,239,python annotations void type-hinting python-typing
What is a good practice to check if an environmental variable exists or not?,239,python python-2.7 python-3.x if-statement environment-variables
How to install both Python 2.x and Python 3.x in Windows,239,python windows compatibility backwards-compatibility build-environment
"In Python, what happens when you import inside of a function? [duplicate]",239,python python-import
Find the most common element in a list,238,python list
Convert string to Python class object?,238,python
Writing a Python list of lists to a csv file,238,python file csv file-io python-2.7
Apply vs transform on a group object,238,python pandas
How do I format a date in Jinja2?,238,python jinja2
How do I initialize weights in PyTorch?,238,python machine-learning deep-learning neural-network pytorch
How do I raise the same Exception with a custom message in Python?,238,python exception message
How do you write tests for the argparse portion of a python module?,238,python unit-testing argparse
Is it possible to set a number to NaN or infinity?,238,python numeric nan infinite
How to convert comma-delimited string to list in Python?,238,python parsing list tuples
Convert columns into rows with Pandas,238,python pandas
What's the purpose of Django setting ‘SECRET_KEY’?,238,python django security encryption
How can I create directories recursively? [duplicate],237,python
How to add a string in a certain position?,237,python string
How to run multiple Python versions on Windows,237,python windows compatibility
SSL InsecurePlatform error when using Requests package,237,python ssl python-requests
Creating Threads in python,237,python multithreading
How to do a scatter plot with empty circles in Python?,237,python matplotlib geometry scatter-plot scatter
Getting the docstring from a function,237,python
Split a string by a delimiter in python,237,python string list split
How to ignore deprecation warnings in Python,236,python warnings deprecated
How to do a recursive sub-folder search and return files in a list?,236,python list recursion os.walk
How to calculate the time interval between two time strings,236,python time python-datetime
Plotting a 2D heatmap,236,python matplotlib seaborn heatmap
How do I get current URL in Selenium Webdriver 2 Python?,236,python selenium selenium-webdriver
How to replace NaNs by preceding or next values in pandas DataFrame?,236,python python-3.x pandas dataframe nan
Class inheritance in Python 3.7 dataclasses,236,python python-3.x python-3.7 python-dataclasses
Python Request Post with param data,236,python httprequest python-requests http-status-codes
How to check a string for specific characters?,236,python string
Why is the use of len(SEQUENCE) in condition values considered incorrect by Pylint?,236,python conditional-statements pylint
Is there a difference between using a dict literal and a dict constructor?,236,python dictionary pycharm
What is the difference between a pandas Series and a single-column DataFrame?,236,python pandas
"""ERROR:root:code for hash md5 was not found"" when using any hg mercurial commands",235,python macos openssl mercurial homebrew
plot a circle with pyplot,235,python matplotlib
Label axes on Seaborn Barplot,235,python matplotlib seaborn bar-chart
How to make an immutable object in Python?,235,python python-3.x immutability
Python csv string to array,235,python string arrays csv
How to plot in multiple subplots,235,python pandas matplotlib seaborn subplot
Wrap long lines in Python [duplicate],235,python string
Concurrent.futures vs Multiprocessing in Python 3,235,python python-3.x multiprocessing
"What does the ""-U"" option stand for in pip install -U",235,python command-line pip
What is pyproject.toml file for?,235,python pip packaging pyproject.toml
How to remove frame from matplotlib (pyplot.figure vs matplotlib.figure ) (frameon=False Problematic in matplotlib),234,python matplotlib
"Error: ""dictionary update sequence element #0 has length 1; 2 is required"" on Django 1.4",234,python django uwsgi
Sorting a Python list by two fields [duplicate],234,python sorting
What can you use generator functions for?,234,python generator
NameError: name 'reduce' is not defined in Python,234,python reduce python-3.2
Date ticks and rotation in matplotlib,234,python matplotlib
Write to UTF-8 file in Python,234,python utf-8 character-encoding byte-order-mark
"What is the purpose of the ""send"" function on Python generators?",234,python generator
How to increment a datetime by one day?,234,python datetime
VSCode -- how to set working directory for debugging a Python program,234,python visual-studio-code
Difference between except: and except Exception as e:,234,python python-3.x
Accessing class variables from a list comprehension in the class definition,234,python python-3.x scope list-comprehension python-internals
How to escape curly-brackets in f-strings? [duplicate],234,python python-3.x curly-braces f-string
Is it possible to decompile a compiled .pyc file into a .py file?,234,python decompiling pyc compiled
"Fatal error in launcher: Unable to create process using """"C:\Program Files (x86)\Python33\python.exe"" ""C:\Program Files (x86)\Python33\pip.exe""""",233,python pip
Execute code when Django starts ONCE only?,233,python django
Python - Extracting and Saving Video Frames,233,python python-2.7 opencv
How do I retrieve the number of columns in a Pandas data frame?,233,python pandas dataframe
_tkinter.TclError: no display name and no $DISPLAY environment variable,233,python matplotlib tkinter
How can I one hot encode in Python?,233,python pandas machine-learning one-hot-encoding
How to convert a string to utf-8 in Python,233,python python-2.7 unicode utf-8
Python - json without whitespaces,233,python json serialization
"pip installs packages successfully, but executables not found from command line",233,python macos pip macports
How to embed HTML into IPython output?,233,python html ipython jupyter-notebook
Why does Python code use len() function instead of a length method?,233,python
anaconda update all possible packages?,233,python anaconda conda
How to count the number of true elements in a NumPy bool array,233,python arrays numpy count boolean
Specifying and saving a figure with exact size in pixels,233,python matplotlib figsize
Check if a word is in a string in Python,232,python string
'Conda' is not recognized as internal or external command,232,python anaconda conda data-science
How to get the last N rows of a pandas DataFrame?,232,python pandas dataframe
Good Python modules for fuzzy string comparison? [closed],232,python string string-comparison fuzzy-comparison
How to strip all whitespace from string,232,python python-3.x spaces strip
Encoding an image file with base64,232,python base64
Automatic creation date for Django model form objects,232,python django django-models
Display a decimal in scientific notation,232,python string-formatting number-formatting scientific-notation
Is there a decorator to simply cache function return values?,232,python caching decorator memoization
python pandas: apply a function with arguments to a series,232,python pandas apply
Python non-greedy regexes,232,python regex regex-greedy
Python function attributes - uses and abuses [closed],232,python function attributes
How can I find the number of arguments of a Python function?,232,python function
JSON to pandas DataFrame,232,python json google-maps pandas
What is the best way to exit a function (which has no return value) in python before the function ends (e.g. a check fails)? [duplicate],232,python function return
Find p-value (significance) in scikit-learn LinearRegression,232,python scikit-learn statistics regression hypothesis-test
How can I specify working directory for popen,232,python subprocess popen
Object of custom type as dictionary key,232,python dictionary
What's a correct and good way to implement __hash__()?,232,python hashtable hashcode dictionary
Can't pickle <type 'instancemethod'> when using multiprocessing Pool.map(),232,python multithreading multiprocessing pickle pool
How do I write good/correct package __init__.py files,232,python package
How to update SQLAlchemy row entry?,231,python sqlalchemy flask-sqlalchemy
Python glob multiple filetypes,231,python glob
has_next in Python iterators?,231,python iterator
How can I replace (or strip) an extension from a filename in Python?,231,python filenames scons strip
How to add hours to current time in python,231,python time add timedelta
Case insensitive replace,231,python string case-insensitive
Ignoring NaNs with str.contains,231,python pandas
Purpose of #!/usr/bin/python3 shebang,231,python scripting
Extract a part of the filepath (a directory) in Python,231,python directory filepath
How to add hovering annotations to a plot,231,python pandas matplotlib seaborn mplcursors
if A vs if A is not None:,231,python
How do I draw a grid onto a plot in Python?,231,python matplotlib
How to install python modules without root access?,231,python numpy pip
Use cases for the 'setdefault' dict method,231,python dictionary setdefault
When and why should I use a namedtuple instead of a dictionary? [duplicate],231,python
Python 3.x rounding behavior,231,python python-3.x rounding
Lists in ConfigParser,230,python configparser
How to skip iterations in a loop?,230,python
"Python Flask, how to set content type",230,python flask
Print list without brackets in a single row,230,python list
AttributeError: 'datetime' module has no attribute 'strptime',230,python class python-2.7
Removing a list of characters in string,230,python string list replace
Generate a heatmap using a scatter data set,230,python matplotlib heatmap histogram2d
Django TemplateDoesNotExist?,230,python python-3.x django django-templates python-2.x
Find difference between two data frames,230,python pandas dataframe
Could not install packages due to an EnvironmentError: [Errno 13],230,python macos pip
"When is ""i += x"" different from ""i = i + x"" in Python?",230,python operators
How to reliably open a file in the same directory as the currently running script,230,python directory
How does tuple comparison work in Python?,230,python comparison tuples
How can I scroll a web page using selenium webdriver in python?,229,python selenium selenium-webdriver automated-tests
How to get current available GPUs in tensorflow?,229,python gpu tensorflow
Integrating Python Poetry with Docker,229,python docker dockerfile python-poetry
"How to test if a string contains one of the substrings in a list, in pandas?",229,python string pandas dataframe match
Numpy - add row to array,229,python arrays numpy rows
Python: Why is functools.partial necessary?,229,python functional-programming partial-application
How to assert two list contain the same elements in Python? [duplicate],229,python unit-testing
Difference between defining typing.Dict and dict?,229,python dictionary type-hinting python-typing
How do I get the path of the current executed file in Python?,229,python path directory
"Trying to mock datetime.date.today(), but not working",228,python testing datetime mocking
How can I get dictionary key as variable directly in Python (not by searching from value)?,228,python dictionary key
python dataframe pandas drop column using int,228,python pandas dataframe
How can I time a code segment for testing performance with Pythons timeit?,228,python testing timeit database-tuning
Running a specific test case in Django when your app has a tests directory,228,python django unit-testing
Iterate over object attributes in python [duplicate],228,python oop attributes iteration
ImportError: No module named matplotlib.pyplot,228,python matplotlib
"Convert [key1,val1,key2,val2] to a dict?",228,python list dictionary
How to divide flask app into multiple py files?,228,python flask
python: Change the scripts working directory to the script's own directory,228,python working-directory
How to retrieve inserted id after inserting row in SQLite using Python?,228,python sqlite
