question,votes,tags
"super() raises ""TypeError: must be type, not classobj"" for new-style class",343,python superclass super typeerror
"What SOAP client libraries exist for Python, and where is the documentation for them? [closed]",343,python soap soap-client
Get loop count inside a for-loop [duplicate],342,python for-loop
Pandas DataFrame to List of Dictionaries,342,python list dictionary pandas dataframe
Getting a hidden password input,342,python passwords user-input
How do I implement interfaces in python?,342,python oop
What does enumerate() mean?,342,python enumerate
"How to send a ""multipart/form-data"" with requests in python?",342,python python-requests multipartform-data
Generate 'n' unique random numbers within a range [duplicate],342,python random unique
How to split a dataframe string column into two columns?,341,python dataframe pandas
How do I split a multi-line string into multiple lines?,341,python string split
How to concatenate two dictionaries to create a new one? [duplicate],341,python dictionary concatenation
"Argparse: Required arguments listed under ""optional arguments""?",341,python argparse
How do I clone a Django model instance object and save it to the database?,340,python django django-models
Why isn't the 'global' keyword needed to access a global variable?,340,python global-variables
How to install Python MySQLdb module using pip?,340,python mysql pip
How do I remove NaN values from a NumPy array?,340,python numpy nan
"DatabaseError: current transaction is aborted, commands ignored until end of transaction block?",340,python django postgresql psycopg2
Sibling package imports,340,python package python-import siblings
why should I make a copy of a data frame in pandas,340,python pandas chained-assignment
What will happen if I modify a Python script while it's running?,340,python
"Comparing two dictionaries and checking how many (key, value) pairs are equal",339,python dictionary comparison
How can I format a decimal to always show 2 decimal places?,339,python string-formatting
Plot two histograms on single chart with matplotlib,339,python matplotlib plot histogram
Apply pandas function to column to create multiple new columns?,339,python pandas merge multiple-columns return-type
How to sum all the values in a dictionary?,339,python dictionary hash sum
How to open a file for both reading and writing?,339,python file file-io
Convert Pandas column containing NaNs to dtype `int`,339,python pandas dataframe nan dtype
Understanding the map function,339,python higher-order-functions map-function
How to execute a Python script from the Django shell?,338,python django django-shell
Python 3: UnboundLocalError: local variable referenced before assignment [duplicate],338,python python-3.x scope
Count unique values per groups with Pandas [duplicate],338,python pandas group-by unique pandas-groupby
How to remove \xa0 from string in Python?,338,python python-2.7 unicode beautifulsoup utf-8
Can Flask have optional URL parameters?,338,python flask
Install tkinter for Python [duplicate],338,python linux tkinter installation
"Error ""Microsoft Visual C++ 14.0 is required (Unable to find vcvarsall.bat)""",338,python python-3.x visual-c++
json.dumps vs flask.jsonify,338,python json flask
Selecting with complex criteria from pandas.DataFrame,338,python pandas
What are type hints in Python 3.5?,338,python python-3.x python-3.5 type-hinting python-typing
Jupyter Notebook not saving: '_xsrf' argument missing from post,337,python google-chrome anaconda jupyter-notebook
How to dynamically build a JSON object?,337,python json
"In Python, when to use a Dictionary, List or Set?",336,python list dictionary data-structures set
Split (explode) pandas dataframe string entry to separate rows,336,python pandas numpy dataframe
How do I determine what type of exception occurred?,336,python exception
correct way to define class variables in Python [duplicate],336,python class attributes
Python Requests - No connection adapters,336,python python-2.7 python-requests
Update a dataframe in pandas while iterating row by row,336,python pandas updates dataframe
InsecurePlatformWarning: A true SSLContext object is not available. This prevents urllib3 from configuring SSL appropriately [duplicate],336,python rest ssl
What does Python's eval() do?,336,python eval
Python: One Try Multiple Except,336,python syntax exception-handling
Python truncate a long string,335,python
Django: Display Choice Value,335,python django django-models django-templates
Could not find a version that satisfies the requirement tensorflow,335,python python-3.x python-2.7 tensorflow pip
Can I add comments to a pip requirements file?,335,python comments pip
I can't install python-ldap,334,python module ldap python-ldap
"In Python, how do I convert all of the items in a list to floats?",334,python list casting
How do I pass a string into subprocess.Popen (using the stdin argument)?,334,python subprocess stdin
How can I obtain the element-wise logical NOT of a pandas Series?,334,python pandas operators boolean-logic
"CSV in Python adding an extra carriage return, on Windows",333,python windows csv newline
Convert columns to string in Pandas,333,python pandas string type-conversion
What's the best way to parse command line arguments? [duplicate],333,python command-line command-line-arguments
How do I plot in real-time in a while loop using matplotlib?,333,python matplotlib while-loop real-time
Efficient way to rotate a list in python,333,python list
"In Python, how do you convert seconds since epoch to a `datetime` object?",333,python datetime date time epoch
What does '# noqa' mean in Python comments?,333,python comments terminology code-analysis pep8
"Using pickle.dump - TypeError: must be str, not bytes",333,python python-3.x pickle
How to check if a value exists in a dictionary?,333,python dictionary find
Executing command line programs from within python [duplicate],333,python command-line
Elegant Python function to convert CamelCase to snake_case?,332,python camelcasing
Generating a PNG with matplotlib when DISPLAY is undefined,332,python matplotlib graph
Why isn't Python very good for functional programming? [closed],332,python functional-programming
How do I check if a given Python string is a substring of another one? [duplicate],332,python string substring
Better way to shuffle two numpy arrays in unison,331,python numpy random shuffle numpy-ndarray
Getting the exception value in Python,331,python exception
Programmatically generate video or animated GIF in Python?,331,python video wxpython animated-gif
Set variable in jinja,331,python templates variables variable-assignment jinja2
How to truncate the time on a datetime object?,331,python datetime
How do you convert a time.struct_time object into a datetime object?,331,python datetime
Mapping over values in a python dictionary,331,python dictionary map-function
Why doesn't Python have a sign function?,331,python language-design
Installing pip packages to $HOME folder,331,python pip
Convert array of indices to one-hot encoded array in NumPy,330,python numpy machine-learning numpy-ndarray one-hot-encoding
Extracting specific selected columns to new DataFrame as a copy,330,python pandas chained-assignment
How to get method parameter names?,330,python decorator introspection python-datamodel
error UnicodeDecodeError: 'utf-8' codec can't decode byte 0xff in position 0: invalid start byte,330,python python-3.x utf-8
How do I get Flask to run on port 80?,329,python networking flask port
How to activate virtualenv in Linux?,329,python python-3.x linux virtualenv python-venv
Send HTML emails with Python,329,python html email html-email
How do I profile memory usage in Python?,329,python memory profiling
PyCharm shows unresolved references error for valid code,328,python pycharm
Redirecting to URL in Flask,328,python redirect flask
_csv.Error: field larger than field limit (131072),328,python csv
Split a string by spaces -- preserving quoted substrings -- in Python,328,python regex
Access multiple elements of list knowing their index [duplicate],328,python python-3.x list indexing element
Virtualenv Command Not Found,327,python macos virtualenv
Python JSON serialize a Decimal object,327,python json floating-point decimal
Check if a given key already exists in a dictionary and increment it,327,python dictionary
How can I find the current OS in Python? [duplicate],327,python cross-platform platform-specific
"How to set a single, main title above all the subplots with Pyplot?",327,python matplotlib
How can I create a copy of an object in Python?,327,python oop object copy
Plot correlation matrix using pandas,326,python pandas matplotlib data-visualization information-visualization
How to search and replace text in a file?,326,python python-3.x string file replace
How to get all values from python enum class?,325,python enums
How to have one colorbar for all subplots,325,python matplotlib subplot colorbar
Disable Tensorflow debugging information,325,python tensorflow
Is Python strongly typed?,325,python strong-typing weak-typing
How to check if a user is logged in (how to properly use user.is_authenticated)?,325,python django authentication
Why do I need 'b' to encode a string with Base64?,325,python python-3.x base64
Python string.join(list) on object array rather than string array,325,python list
pandas: merge (join) two data frames on multiple columns,325,python python-3.x pandas join
Named colors in matplotlib,324,python matplotlib colors
Understanding NumPy's einsum,324,python arrays numpy multidimensional-array numpy-einsum
Concatenating two lists - difference between '+=' and extend(),324,list python
Best ways to teach a beginner to program? [closed],324,python language-agnostic
How to send an email with Gmail as provider using Python?,323,python email smtp gmail smtp-auth
How can I implement a tree in Python?,323,python data-structures tree
Element-wise addition of 2 lists?,323,python list elementwise-operations
"Python != operation vs ""is not""",323,python operators
How to get the return value of a function passed to multiprocessing.Process?,323,python function multiprocessing return-value python-multiprocessing
"How to use ""raise"" keyword in Python [duplicate]",323,python keyword raise
'str' object has no attribute 'decode'. Python 3 error?,323,python python-3.x imaplib
"In Python, how do I split a string and keep the separators?",322,python regex
Find row where values for column is maximal in a pandas DataFrame,322,python pandas dataframe row argmax
Get human readable version of file size?,321,python code-snippets filesize
Normal arguments vs. keyword arguments,321,python arguments keyword optional-parameters named-parameters
Is there shorthand for returning a default value if None in Python? [duplicate],321,python
Retrieving the output of subprocess.call() [duplicate],321,python pipe subprocess stringio
How to import module when module name has a '-' dash or hyphen in it?,321,python import module
Compare object instances for equality by their attributes,321,python equality
Why use argparse rather than optparse?,321,python command-line optparse getopt argparse
Recommendations of Python REST (web services) framework? [closed],321,python web-services rest frameworks
How do I update a Python package?,320,python linux installation package m2crypto
Split a Pandas column of lists into multiple columns,320,python pandas list dataframe split
Escaping regex string,320,python regex
TypeError: unhashable type: 'dict',320,python
When should I be using classes in Python?,320,python oop
ImportError: No module named PIL,319,python python-imaging-library easy-install
How to select rows with one or more nulls from a pandas DataFrame without listing columns explicitly?,319,python pandas null nan
How do you run a Python script as a service in Windows?,319,python windows cross-platform
Difference between os.getenv and os.environ.get,319,python environment-variables python-os
Inserting image into IPython notebook markdown,318,python jupyter-notebook ipython jupyter
Raise warning in Python without interrupting program,318,python exception error-handling warnings
Split / Explode a column of dictionaries into separate columns with pandas,318,python json pandas dictionary json-normalize
How to call a Python function from Node.js,318,python node.js express
How to check whether a variable is a class or not?,318,python reflection
"What does ""hashable"" mean in Python?",318,python
What is the easiest way to get current GMT time in Unix timestamp format?,317,python time unix-timestamp
How to remove specific elements in a numpy array,317,python arrays numpy
How to install Python package from GitHub? [duplicate],317,python pip
Create empty file using python [duplicate],317,python
Comprehension on a nested iterables?,316,python list nested list-comprehension
Compiled vs. Interpreted Languages,316,java python compiler-construction programming-languages interpreter
Deleting folders in python recursively,316,python directory
Round number to nearest integer,316,python
How to read a single character from the user?,316,python input
How do I run Python code from Sublime Text 2?,316,python ide sublimetext2 sublimetext
"Calling parent class __init__ with multiple inheritance, what's the right way?",316,python oop inheritance multiple-inheritance super
ImportError: No module named pip,315,python macos pip
check if a key exists in a bucket in s3 using boto3,315,python amazon-s3 boto3
How to get Linux console window width in Python,315,python linux console terminal width
Label encoding across multiple columns in scikit-learn,315,python pandas scikit-learn
Matplotlib (pyplot) savefig outputs blank image,315,python image matplotlib figure
Convert string date to timestamp in Python,315,python datetime
Using global variables between files?,315,python share global
How to override the [] operator in Python?,315,python operator-overloading
How to execute raw SQL in Flask-SQLAlchemy app,314,python sql sqlalchemy flask flask-sqlalchemy
How to take column-slices of dataframe in pandas,314,python pandas numpy dataframe slice
How to find the installed pandas version,314,python pandas
What does .view() do in PyTorch?,314,python memory pytorch tensor
Replace non-ASCII characters with a single space,314,python unicode encoding ascii
Python recursive folder read,313,python scripting file-io
Format a datetime into a string with milliseconds,313,python datetime string-formatting milliseconds
How to install multiple python packages at once using pip,313,python pip
Python requests - print entire http request (raw)?,313,python http python-requests
Best practices for adding .gitignore file for Python projects? [closed],313,python django git pygtk gitignore
BeautifulSoup getting href [duplicate],313,python tags beautifulsoup
remove None value from a list without removing the 0 value,312,python list filter list-comprehension nonetype
Python mock multiple return values,312,python unit-testing mocking python-mock
How to pick just one item from a generator?,312,python iterator generator python-2.x
SyntaxError: Non-ASCII character '\xa3' in file when function returns '£',311,python unicode python-unicode
Failed to install Python Cryptography package with PIP and setup.py,311,python cryptography pip
How to extract text from a PDF file?,311,python pdf
"How can I read large text files line by line, without loading them into memory? [duplicate]",311,python file-io
"Sending ""User-agent"" using Requests library in Python",311,python web-crawler python-requests
Simplify Chained Comparison,311,python pycharm
Simple way to measure cell execution time in ipython notebook,310,python jupyter-notebook ipython jupyter
List files ONLY in the current directory,310,python
What's the u prefix in a Python string?,310,python syntax
Defining private module functions in python,309,python function module private
Display help message with Python argparse when script is called without any arguments,309,python argparse
How to sort with lambda in Python,309,python sorting functional-programming anonymous-function
"Wrapping a C library in Python: C, Cython or ctypes?",309,python c ctypes cython
How to annotate types of multiple return values?,309,python type-hinting python-typing
Favorite Django Tips & Features?,308,python django hidden-features
Cron and virtualenv,308,python django cron virtualenv
Why is there no xrange function in Python3?,308,python python-3.x pep xrange
Timeout for python requests.get entire response,307,python timeout python-requests
How do I integrate Ajax with Django applications?,307,python ajax django
Checking if type == list in python [duplicate],307,python
Exit codes in Python,307,python exit-code
"Docker ""ERROR: could not find an available, non-overlapping IPv4 address pool among the defaults to assign to the network""",306,python docker docker-compose
libxml install error using pip,306,python lxml pip
How to select a drop-down menu value with Selenium using Python?,306,python selenium selenium-webdriver webdriver html-select
How to convert a UTC datetime to a local datetime using only standard library?,306,python datetime timezone python-datetime
what does the __file__ variable mean/do?,306,python self-reference
Upgrade python in a virtualenv,306,python pip virtualenv version requirements
How to change dataframe column names in PySpark?,305,python apache-spark pyspark apache-spark-sql rename
How do you extract a column from a multi-dimensional array?,305,python arrays multidimensional-array extraction
Filtering Pandas DataFrames on dates,305,python datetime pandas filtering dataframe
"Python Image Library fails with message ""decoder JPEG not available"" - PIL",305,python jpeg python-imaging-library pillow
"Error ""Import Error: No module named numpy"" on Windows",305,python python-3.x numpy import scipy
Python function overloading,305,python class oop overloading multiple-dispatch
Python Create unix timestamp five minutes in the future,304,python datetime unix-timestamp
Appending to an empty DataFrame in Pandas?,304,python pandas
How does functools partial do what it does?,304,python functional-programming currying functools partial-application
How to convert an integer to a string in any base?,304,python base radix
How do I check if I'm running on Windows in Python? [duplicate],304,python platform platform-specific
How to find all the subclasses of a class given its name?,304,python subclass
How to print the value of a Tensor object in TensorFlow?,304,python tensorflow tensor
How to update an existing Conda environment with a .yml file,304,python django anaconda conda
How to exit from Python without traceback?,304,python exit traceback
How should I log while using multiprocessing in Python?,304,python logging multiprocessing
"standard_init_linux.go:178: exec user process caused ""exec format error""",303,python linux bash docker
Wait until page is loaded with Selenium WebDriver for Python,303,python selenium execute-script
"Using Python's os.path, how do I go up one directory?",303,python django
Display image as grayscale using matplotlib,303,python matplotlib grayscale
How do I check if a string is unicode or ascii?,303,python unicode encoding utf-8
Counting the number of distinct keys in a dictionary in Python,303,python dictionary count keyword
Are tuples more efficient than lists in Python?,302,python performance list tuples python-internals
Python's most efficient way to choose longest string in list?,302,python list
How do I loop through a list by twos? [duplicate],302,python list loops for-loop iteration
Check if string ends with one of the strings from a list,302,python string list
Extracting text from HTML file using Python,302,python html text html-content-extraction
How to process SIGTERM signal gracefully?,302,python daemon sigterm start-stop-daemon
What is the problem with shadowing names defined in outer scopes?,302,python pycharm shadowing
Why does PEP-8 specify a maximum line length of 79 characters? [closed],302,python coding-style pep8
Create a directly-executable cross-platform GUI app using Python,302,python user-interface deployment tkinter release-management
What is pip's equivalent of `npm install package --save-dev`?,302,python node.js pip
Can I set max_retries for requests.request?,301,python python-requests
How to get string objects instead of Unicode from JSON,301,python json serialization unicode python-2.x
Convert timedelta to total seconds,301,python datetime
How do I execute a program from Python? os.system fails due to spaces in path,301,python shellexecute
How are glob.glob()'s return values ordered?,300,python glob
Get IP address of visitors using Flask for Python,300,python flask ip-address werkzeug
Python - Count elements in list [duplicate],300,python list
TypeError: got multiple values for argument,300,python python-3.x
Django set default form values,300,python django django-models django-forms
Is there a way to detach matplotlib plots so that the computation can continue?,300,python matplotlib plot
How to get http headers in flask?,300,python http flask http-headers authorization
Convert a tensor to numpy array in Tensorflow?,300,python numpy tensorflow
Why do python lists have pop() but not push(),300,python
socket.error: [Errno 48] Address already in use,299,python macos simplehttpserver
How to sort a list of lists by a specific index of the inner list?,299,python sorting
Modify tick label text,299,python matplotlib xticks yticks
Progress indicator during pandas operations,299,python pandas ipython
"PyLint ""Unable to import"" error - how to set PYTHONPATH?",299,python virtualenv pylint pythonpath
How can I display an image from a file in Jupyter Notebook?,298,python jupyter-notebook ipython
Read file from line 2 or skip header row,298,python file-io
How to Customize the time format for Python logging?,298,python datetime logging formatting
Check if a string contains a number,298,python string
Can't compare naive and aware datetime.now() <= challenge.datetime_end,298,python django datetime comparison
Django template how to look up a dictionary value with a variable,298,python django templates dictionary
How to print pandas DataFrame without index,298,python datetime pandas dataframe
"E731 do not assign a lambda expression, use a def",298,python lambda flake8 pep
difference between variables inside and outside of __init__() (class and instance attributes),298,python class oop constructor
How to normalize a NumPy array to a unit vector?,298,python numpy scikit-learn statistics normalization
How do I install Python OpenCV through Conda?,297,python opencv anaconda conda
Convert UTC datetime string to local datetime,297,python datetime utc localtime
How do I read a large csv file with pandas?,297,python pandas csv memory chunks
Check if item is in an array / list,297,python arrays contains
How to fix Python indentation,297,python
What is the purpose of the -m switch?,297,python command-line module package
read subprocess stdout line by line,297,python subprocess
Django Template Variables and Javascript,296,javascript python django google-app-engine django-templates
boto3 client NoRegionError: You must specify a region error only sometimes,296,python linux amazon-web-services boto3 aws-kms
How to handle errors with boto3?,296,python amazon-web-services boto boto3
"Why does ""pip install"" inside Python raise a SyntaxError?",296,python pip installation
"Remove duplicates by columns A, keeping the row with the highest value in column B",296,python duplicates pandas
How to check if all elements of a list match a condition?,296,python list for-loop while-loop
Python foreach equivalent [duplicate],296,python foreach
Django gives Bad Request (400) when DEBUG = False,296,python django
What is the correct syntax for 'else if'?,296,python python-3.x
Possibilities for Python classes organized across files? [closed],296,python class project-structure
Javascript equivalent of Python's zip function,296,javascript python functional-programming transpose
What's the difference between dist-packages and site-packages?,296,python pip easy-install package-managers
pandas three-way joining multiple dataframes on columns,295,python pandas join merge
Plot a horizontal line on a given plot,295,python pandas matplotlib seaborn
Constantly print Subprocess output while process is running,295,python subprocess
Iterating over every two elements in a list [duplicate],294,python list
How do I convert a Pandas series or index to a NumPy array? [duplicate],294,python pandas
Correct way to use get_or_create?,294,python django
tight_layout() doesn't take into account figure suptitle,294,python matplotlib
How to implement the Softmax function in Python,294,python numpy machine-learning logistic-regression softmax
Does Conda replace the need for virtualenv?,294,python scipy virtualenv anaconda conda
Chain-calling parent initialisers in python [duplicate],294,python oop inheritance constructor
How can I convert JSON to CSV?,293,python json csv json-normalize
Storing Python dictionaries,293,python json dictionary save pickle
str.startswith with a list of strings to test for,293,python string list
How do I make a single legend for many subplots?,293,python matplotlib
How should I use the Optional type hint?,293,python python-3.x type-hinting python-typing
Python app does not print anything when running detached in docker,292,python docker dockerfile
How can I convert an RGB image into grayscale in Python?,292,python matplotlib
Merge two dataframes by index,292,python pandas dataframe merge concat
Seaborn plots not showing up,292,python matplotlib seaborn
Using headers with the Python requests library's get method,292,python http-request python-requests
"pandas groupby, then sort within groups",292,python sorting pandas group-by
Pandas create empty DataFrame with only column names,292,python pandas dataframe
