question,votes,tags
Filter dataframe rows if value in column is in a set list of values [duplicate],565,python pandas dataframe
Is there a way to specify which pytest tests to run from a file?,563,python pytest
Get all object attributes in Python? [duplicate],563,python introspection python-2.6
How to round to 2 decimals with Python? [duplicate],562,python rounding
Change the name of a key in dictionary,562,python dictionary
Install a Python package into a different directory using pip?,561,python pip
Iterating each character in a string using Python,561,python string iteration
How to find all occurrences of an element in a list,560,python list indices
How to specify multiple return types using type-hints,559,python python-3.x type-hinting return-type python-typing
Multiple variables in a 'with' statement?,559,python with-statement
What is the difference between '/' and '//' when used for division?,559,python math syntax operators floor-division
Import error: No module name urllib2,558,python python-3.x urllib2
How to delete a character from a string using Python,558,python string
How can I explicitly free memory in Python?,556,python memory memory-management
Where do the Python unit tests go? [closed],555,python unit-testing code-organization
How do I access command line arguments?,554,python command-line command-line-arguments
Creating a JSON response using Django and Python,553,python django json
"What's the difference between eval, exec, and compile?",553,python dynamic eval exec
Creating a range of dates in Python,550,python datetime date
Which version of Python do I have installed?,550,python version windows-server
how to sort pandas dataframe from one column,550,python pandas dataframe sorting time
Text progress bar in terminal with block characters [closed],549,python console progress updating
Selecting a row of pandas series/dataframe by integer index,549,python pandas dataframe indexing
How to check if a column exists in Pandas,548,python pandas dataframe
Writing unit tests in Python: How do I start? [closed],548,python unit-testing testing
"Remap values in pandas column with a dict, preserve NaNs",546,python dictionary pandas remap
JSONDecodeError: Expecting value: line 1 column 1 (char 0),546,python json curl
How to list all functions in a module?,545,python reflection module inspect
How to comment out a block of code in Python [duplicate],545,python docstring
How do I read CSV data into a record array in NumPy?,544,python numpy scipy genfromtxt
What are the advantages of NumPy over regular Python lists?,544,python arrays list numpy numpy-ndarray
Is it a good practice to use try-except-else in Python?,544,python exception exception-handling try-catch
"What are iterator, iterable, and iteration?",543,python iterator iteration terminology iterable
No module named pkg_resources,543,python django virtualenv setuptools pip
How do I create a list with numbers between two values?,542,python list
Python: How to ignore an exception and proceed? [duplicate],539,python exception
How to find all occurrences of a substring?,539,python string
Plot logarithmic axes,538,python matplotlib logarithm yticks
"Why do some functions have underscores ""__"" before and after the function name?",538,python function methods double-underscore
Python datetime to string without microsecond component,537,python datetime datetime-format
How do I find the time difference between two datetime objects in python?,537,python datetime date-arithmetic
"return, return None, and no return at all?",537,python null return
Understanding dict.copy() - shallow or deep?,536,python dictionary copy
Is there any pythonic way to combine two dicts (adding values for keys that appear in both)?,536,python dictionary
Deep copy of a dict in python,536,python python-3.x
Reimport a module while interactive,535,python
Difference between __getattr__ and __getattribute__,535,python getattr getattribute
Flatten an irregular (arbitrarily nested) list of lists,535,python list optimization nested-lists flatten
Convert a Unicode string to a string in Python (containing extra symbols),534,python string unicode type-conversion
Printing Lists as Tabular Data,533,python
How do I get the path and name of the file that is currently executing?,533,python scripting file
beyond top level package error in relative import,533,python import package
'pip' is not recognized as an internal or external command,532,python django windows pip
How to write inline if statement for print?,532,python if-statement conditional-statements inline
Explaining Python's '__enter__' and '__exit__',532,python oop with-statement contextmanager
Convert Python dict into a dataframe,531,python pandas dataframe
Creating a new dictionary in Python,531,python dictionary
Check if all elements in a list are identical,529,python algorithm comparison
Expanding tuples into arguments,529,python tuples parameter-passing
Get list from pandas dataframe column or row?,529,python pandas list dataframe
Read .mat files in Python,528,python matlab file-io scipy mat-file
"List vs tuple, when to use each? [duplicate]",527,python list types tuples
Python string.replace regular expression [duplicate],526,python regex replace
Sort a list of tuples by 2nd item (integer value) [duplicate],526,python list tuples
Append values to a set in Python,526,python set append
What happens when using mutual or circular (cyclic) imports?,526,python python-import circular-dependency cyclic-reference
How to update/upgrade a package using pip?,526,python pip
Checking whether a string starts with XXXX,524,python string string-comparison
Append a dictionary to a dictionary [duplicate],523,python dictionary
"Elegant ways to support equivalence (""equality"") in Python classes",522,python equality equivalence
Unresolved reference issue in PyCharm,521,python ide pycharm
Pandas read_csv: low_memory and dtype options,521,python parsing numpy pandas dataframe
How do I determine if my python shell is executing in 32bit or 64bit?,520,python macos
Changing one character in a string,520,python string
Run function from the command line,519,python function command-line
How do I remove a substring from the end of a string?,519,python string
How to reset index in a pandas dataframe? [duplicate],519,python indexing pandas dataframe
How can I rename a conda environment?,519,python anaconda conda
How to select all columns except one in pandas?,518,python pandas
How do I increase the cell width of the Jupyter/ipython notebook in my browser?,518,python jupyter-notebook ipython jupyter
How to flatten a hierarchical index in columns,518,python pandas dataframe multi-index
Suppress InsecureRequestWarning: Unverified HTTPS request is being made in Python2.6,517,python python-2.6 suppress-warnings urllib3 pyvmomi
"Is there a simple, elegant way to define singletons? [duplicate]",517,python design-patterns singleton
Determine if variable is defined in Python [duplicate],515,python variables defined
How can I use the apply() function for a single column?,515,python pandas dataframe
Pretty printing XML in Python,515,python xml pretty-print
Short description of the scoping rules?,515,python scope
Is it possible to use pip to install a package from a private GitHub repository?,514,python git github pip
How do I create variable variables?,513,python variable-variables
Installation Issue with matplotlib Python [duplicate],511,python macos matplotlib anaconda
How to group dataframe rows into list in pandas groupby,511,python pandas list aggregate pandas-groupby
Iterating through a range of dates in Python,510,python date datetime iteration date-range
"How to fix: ""UnicodeDecodeError: 'ascii' codec can't decode byte""",509,python python-2.7 chinese-locale
No module named MySQLdb,509,python django python-2.x
Why are there no ++ and -- operators in Python?,509,python operators
Python Progress Bar,508,python progress-bar
Get the last 4 characters of a string [duplicate],508,python string
Case insensitive regular expression without re.compile?,508,python regex case-sensitive case-insensitive
Difference between exit() and sys.exit() in Python,508,python exit
How do I create test and train samples from one dataframe with pandas?,507,python python-2.7 pandas dataframe
How can I compare two lists in python and return matches [duplicate],507,python list
How do I get the parent directory in Python?,507,python
Reloading submodules in IPython,507,python ipython
Should import statements always be at the top of a module?,507,python optimization pep8
Generator expressions vs. list comprehensions,506,python list-comprehension generator-expression
Python Dictionary Comprehension,504,python dictionary list-comprehension
Error after upgrading pip: cannot import name 'main',502,python pip
Hiding axis text in matplotlib plots,501,python matplotlib plot
"What is the python ""with"" statement designed for?",501,python language-features with-statement
Remove all occurrences of a value from a list?,500,python list
Get the first item from an iterable that matches a condition,500,python iterator
Rotate axis text in python matplotlib,498,python matplotlib
Improve subplot size/spacing with many subplots,498,python pandas matplotlib seaborn subplot
Find index of last occurrence of a substring in a string,498,python string
Print a list in reverse order with range()?,497,python list range reverse
How to extract the substring between two markers?,497,python string substring
"What is the difference between ""is None"" and ""== None""",497,python
Check if string matches pattern,496,python regex string-matching
Converting dictionary to JSON,495,python json python-2.7 dictionary
"Why do we need the ""finally"" clause in Python?",494,python exception-handling try-finally
Selecting/excluding sets of columns in pandas [duplicate],493,python pandas dataframe
List attributes of an object [duplicate],493,python class python-3.x
How to pretty print nested dictionaries?,491,python dictionary
What is __main__.py?,490,python
The difference between sys.stdout.write and print?,490,python printing stdout
How to download image using requests,489,python urllib2 python-requests
"Why does ""not(True) in [False, True]"" return False?",489,python operator-precedence comparison-operators
Get first row value of a given column,489,python pandas indexing head
What is the standard way to add N seconds to datetime.time in Python?,489,python datetime time math
How to compare two dates?,489,python datetime
Python Requests throwing SSLError,488,python ssl python-requests urllib3
How to find out if a Python object is a string?,488,python string types compatibility
What is the reason for having '//' in Python? [duplicate],488,python division
Python Pandas: Get index of rows where column matches certain value,486,python pandas dataframe indexing
Sorting arrays in NumPy by column,484,python arrays sorting numpy scipy
How to get the cartesian product of a series of lists,484,python list cartesian-product
"What do the python file extensions, .pyc .pyd .pyo stand for?",484,python pyc
How to invoke the super constructor in Python?,483,python class inheritance constructor superclass
Why is there no tuple comprehension in Python?,482,python tuples list-comprehension dictionary-comprehension set-comprehension
What is a Python equivalent of PHP's var_dump()? [duplicate],482,php python debugging
What is the best way to compare floats for almost-equality in Python?,482,python floating-point
How can I color Python logging output?,481,python logging colors
"Is there a way to perform ""if"" in python's lambda?",481,python lambda conditional-operator
Convert JSON string to dict using Python [duplicate],480,python json string
Automatically creating directories with file output [duplicate],480,python file-io
How to check if an object is a list or tuple (but not string)?,480,python list types assert
How to get week number in Python?,479,python
Installing Python packages from local file system folder to virtualenv with pip,479,python pip
How do I get the path of the Python script I am running in? [duplicate],479,python path
Python unittest - opposite of assertRaises?,479,python unit-testing
How to change legend size with matplotlib.pyplot,478,python size matplotlib legend
Convert base-2 binary number string to int,478,python
Python argparse command line flags without arguments,478,python command-line-arguments argparse
setup script exited with error: command 'x86_64-linux-gnu-gcc' failed with exit status 1,477,python gcc pip odoo
What is the purpose of meshgrid in Python / NumPy?,477,python numpy multidimensional-array mesh numpy-ndarray
How to get POSTed JSON in Flask?,477,python json post flask
Find intersection of two nested lists?,476,python list intersection
Hide all warnings in IPython,476,python warnings ipython
Convert a list of characters into a string [duplicate],475,python string
How do I execute a string containing Python code in Python?,474,python string exec
Implement touch using Python?,473,python utility
How to sort a list of strings?,473,python string sorting
"In pytest, what is the use of conftest.py files?",473,python pytest
How do I find out my PYTHONPATH using Python?,472,python python-module pythonpath
TypeError: method() takes 1 positional argument but 2 were given,472,python methods arguments self
How to query as GROUP BY in django?,471,python django django-models
What's the difference between select_related and prefetch_related in Django ORM?,470,python django django-models django-orm
Running Bash commands in Python,469,python bash
Find nearest value in numpy array,467,python search numpy
What is memoization and how can I use it in Python?,467,python memoization
How to get current CPU and RAM usage in Python?,467,python system cpu status ram
Reading JSON from a file,466,python json
How to format a floating number to fixed width in Python,466,python string numbers number-formatting
What are logits? What is the difference between softmax and softmax_cross_entropy_with_logits?,466,python machine-learning tensorflow
How to declare and add items to an array in Python?,466,python arrays
Pandas conditional creation of a series/dataframe column,465,python pandas numpy dataframe
How to set Python's default version to 3.x on OS X? [duplicate],465,python python-3.x macos installation
"How to embed image or picture in jupyter notebook, either from a local machine or from a web resource?",465,python python-3.x image jupyter-notebook jupyter
How to input a regex in string.replace?,465,python regex string replace
Python dictionary from an object's fields,464,python dictionary attributes object metaprogramming
What does numpy.random.seed(0) do?,464,python numpy
Sorting columns in pandas dataframe based on column name [duplicate],463,python pandas dataframe
How to repeatedly execute a function every x seconds?,463,python timer
What does `ValueError: cannot reindex from a duplicate axis` mean?,463,python pandas
Should you always favor xrange() over range()?,462,python range xrange
No Multiline Lambda in Python: Why not?,461,python syntax lambda
"How to avoid ""RuntimeError: dictionary changed size during iteration"" error?",461,python list dictionary loops
Installing python module within code,460,python pip python-module pypi
How to add an empty column to a dataframe?,460,python pandas
"How to remove axis, legends, and white padding",460,python matplotlib
Count the frequency that a value occurs in a dataframe column,460,python pandas frequency
How to re import an updated package while in Python Interpreter? [duplicate],460,python
"How do I get a value of datetime.today() in Python that is ""timezone aware""?",459,python datetime date timezone
Can I get JSON to load into an OrderedDict?,459,python json load ordereddictionary
How to clear the interpreter console?,458,python windows console
How can I convert a datetime object to milliseconds since epoch (unix time) in Python?,458,python datetime epoch
Python date string to date object,458,python date
Timeout on a function call,458,python multithreading timeout python-multithreading
How can I find all matches to a regular expression in Python?,458,python regex search
How to adjust padding with cutoff or overlapping labels,457,python matplotlib
Working with UTF-8 encoding in Python source [duplicate],457,python encoding utf-8 character-encoding
How to save a Python interactive session?,457,python shell read-eval-print-loop interactive-session
Matplotlib make tick labels font size smaller,456,python matplotlib
"How to add to the PYTHONPATH in Windows, so it finds my modules/packages?",456,python windows environment-variables pythonpath
How to print to console in pytest?,456,python unit-testing python-2.7 pytest
Is there a Python equivalent of the C# null-coalescing operator?,456,python null-coalescing-operator
How do I convert all strings in a list of lists to integers?,456,python string integer
join list of lists in python [duplicate],455,python
Remove xticks in a matplotlib plot?,455,python matplotlib plot
When is del useful in Python?,455,python dictionary python-internals del
How to change the figure size of a seaborn axes or figure level plot,454,python matplotlib seaborn figsize
Substitute multiple whitespace with single whitespace in Python [duplicate],453,python substitution removing-whitespace
How to insert newlines on argparse help text?,453,python argparse
How to install lxml on Ubuntu,452,python ubuntu lxml libxml2 easy-install
UnicodeEncodeError: 'charmap' codec can't encode characters,452,python beautifulsoup urllib
Adding a legend to PyPlot in Matplotlib in the simplest manner possible,452,python matplotlib plot
How to convert JSON data into a Python object?,451,python json django
Python's time.clock() vs. time.time() accuracy?,451,python time
How to delete a record in Django models?,450,python sql django django-models django-queryset
How do I get a Cron like scheduler in Python?,450,python cron scheduled-tasks
Create Pandas DataFrame from a string,450,python string pandas csv csv-import
Python nonlocal statement / keyword,450,python closures global python-nonlocal
What's the best practice using a settings file in Python? [closed],450,python parsing configuration yaml settings
"django order_by query set, ascending and descending",449,python django sorting
"How to get current time in python and break up into year, month, day, hour, minute?",449,python python-2.7 datetime time
Splitting on first occurrence,449,python split
How do I detect the Python version at runtime? [duplicate],448,python
Passing a dictionary to a function as keyword parameters,448,python function dictionary parameters keyword
Generating an MD5 checksum of a file,447,python md5 checksum hashlib
How do I install the yaml package for Python?,447,python python-2.7 yaml pip pyyaml
How can I check the syntax of Python script without executing it?,447,python compilation syntax-checking
What is the best way to call a script from another script? [closed],447,python
How to use timeit module,446,python time timeit
"What does ""SyntaxError: Missing parentheses in call to 'print'"" mean in Python?",445,python python-3.x
How to correct TypeError: Unicode-objects must be encoded before hashing?,445,python python-3.x unicode syntax-error hashlib
Reading binary file and looping over each byte [duplicate],444,python file-io binary
Convert DataFrame column type from string to datetime,444,python pandas dataframe datetime-format python-datetime
Is it possible to make abstract classes?,443,python class inheritance abstract-class abstract
How do Python functions handle the types of parameters that you pass in?,442,python function types parameters
How to sort a dataFrame in python pandas by two or more columns?,442,python pandas python-2.7 sorting data-analysis
Converting Python dict to kwargs?,442,python dictionary keyword-argument
How do I parallelize a simple Python loop?,442,python parallel-processing
How do I get list of methods in a Python class?,441,python
Can't subtract offset-naive and offset-aware datetimes,441,python postgresql datetime timezone
Get the key corresponding to the minimum value within a dictionary,440,python dictionary min minimum idioms
Stripping everything but alphanumeric chars from a string in Python,440,python string non-alphanumeric
Get lengths of a list in a jinja2 template,440,python jinja2
How to install python3 version of package via pip on Ubuntu?,439,python ubuntu python-3.x ubuntu-12.04 pip
Find the similarity metric between two strings,438,python probability similarity metric
defaultdict of defaultdict?,438,python collections
Pretty-print a NumPy array without scientific notation and with given precision,438,python numpy pretty-print
Check if something is (not) in a list in Python,438,python list conditional membership
How do I run all Python unit tests in a directory?,437,python unit-testing testing python-unittest
How to replace multiple substrings of a string?,437,python text replace
Convert Pandas Column to DateTime,437,python datetime pandas
How to uninstall Python 2.7 on a Mac OS X 10.6.4?,436,python macos uninstallation python-2.7
Get the row(s) which have the max value in groups using groupby,436,python pandas dataframe group-by max
What is an alternative to execfile in Python 3?,436,python python-3.x
How can I selectively escape percent (%) in Python strings?,436,python escaping python-2.7
Does Python support short-circuiting?,436,python boolean-logic short-circuiting
What is the difference between an expression and a statement in Python?,436,python expression
Python list vs. array – when to use?,434,python arrays list
Convert datetime object to a String of date only in Python,433,python datetime
How to draw vertical lines on a given plot,433,python pandas matplotlib seaborn
"Converting between datetime, Timestamp and datetime64",433,python datetime numpy pandas
Determine if Python is running inside virtualenv,433,python virtualenv
Sum a list of numbers in Python,433,python list sum
Bare asterisk in function arguments?,433,python python-3.x parameter-passing
How do I check if PyTorch is using the GPU?,432,python memory-management gpu nvidia pytorch
Split by comma and strip whitespace in Python,432,python whitespace strip
Normalize columns of a dataframe,431,python pandas dataframe normalize
"How to use a dot ""."" to access members of dictionary?",431,python dictionary syntax nested nested-properties
Download file from web in Python 3,431,python python-3.x
"Is there a ""not equal"" operator in Python?",431,python operators
Secondary axis with twinx(): how to add to legend?,430,python matplotlib axis legend
How to reversibly store and load a Pandas dataframe to/from disk,430,python pandas dataframe
"Why do many examples use `fig, ax = plt.subplots()` in Matplotlib/pyplot/python",430,python matplotlib plot visualization
Python list sort in descending order,429,python sorting reverse
Which is the preferred way to concatenate a string in Python?,429,python python-3.x string concatenation
"Error ""filename.whl is not a supported wheel on this platform""",428,python pip
How do I disable log messages from the Requests library?,428,python logging python-requests verbosity
Extract a subset of key-value pairs from dictionary?,428,python python-3.x dictionary associative-array
How do I add an extra column to a NumPy array?,427,python numpy
Flattening a shallow list in Python [duplicate],427,python list-comprehension
Convert Django Model object to dict with all of the fields intact,427,python django dictionary django-models django-orm
How do I convert a PIL Image into a NumPy array?,427,python image numpy python-imaging-library numpy-ndarray
How can I filter a Django query with a list of values?,427,python django django-queryset
What are the differences between numpy arrays and matrices? Which one should I use?,427,python arrays matrix numpy
How to tell if tensorflow is using gpu acceleration from inside python shell?,426,python tensorflow ubuntu gpu
"UnicodeDecodeError, invalid continuation byte",426,python unicode decode
"pip is configured with locations that require TLS/SSL, however the ssl module in Python is not available",426,python pip
"Error ""(unicode error) 'unicodeescape' codec can't decode bytes in position 2-3: truncated \UXXXXXXXX escape"" [duplicate]",426,python csv unicode syntax-error
Numpy array dimensions,426,python arrays numpy dimensions
How do I disable the security certificate check in Python requests,425,python https python-requests
Find all packages installed with easy_install/pip?,425,python pip easy-install pypi
How to see the raw SQL queries Django is running?,425,python sql django database django-database
How do I specify new lines in a string in order to write multiple lines to a file?,425,python line-breaks file-writing
How can I specify the function type in my type hints?,425,python python-3.x type-hinting mypy python-typing
How do I create an empty array and then append to it in NumPy?,424,python arrays numpy
python .replace() regex [duplicate],424,python regex
How to add pandas data to an existing csv file?,423,python pandas csv dataframe
Permanently add a directory to PYTHONPATH?,423,python windows pythonpath
Remove pandas rows with duplicate indices,423,python pandas dataframe duplicates
How to take the first N items from a generator or list? [duplicate],423,python list generator
"How to use ""pass"" statement?",423,python statements
Python setup.py develop vs install,423,python setuptools
Simple Digit Recognition OCR in OpenCV-Python,423,python opencv numpy computer-vision ocr
What is the difference between np.array() and np.asarray()?,422,python arrays numpy
What is the difference between 'SAME' and 'VALID' padding in tf.nn.max_pool of tensorflow?,421,python tensorflow deep-learning
Argparse: Way to include default values in '--help'?,421,python argparse
Is there a standardized method to swap two variables in Python?,421,python syntax swap conventions
