question,votes,tags
"What does the ""yield"" keyword do?",12447,python iterator generator
"What does if __name__ == ""__main__"": do?",7867,python namespaces program-entry-point python-module idioms
Does Python have a ternary conditional operator?,7586,python operators conditional-operator
What are metaclasses in Python?,7074,python oop metaclass python-class python-datamodel
How do I check whether a file exists without exceptions?,6861,python file file-exists
How do I merge two dictionaries in a single expression?,6564,python dictionary merge
How do I execute a program or call a system command?,5871,python shell terminal subprocess command
How can I safely create a nested directory?,5406,python exception path directory operating-system
Accessing the index in 'for' loops,4979,python loops list
How do I make a flat list out of a list of lists?,4967,python list multidimensional-array flatten
Difference between @staticmethod and @classmethod,4462,python oop methods python-decorators
Understanding slicing,4409,python slice sequence
Finding the index of an item in a list,4215,python list indexing
Iterating over dictionaries using 'for' loops,4066,python dictionary
Using global variables in a function,3798,python global-variables scope
How to iterate over rows in a DataFrame in Pandas,3712,python pandas dataframe
How do I get the current time?,3655,python datetime time
Catch multiple exceptions in one line (except block),3633,python exception exception-handling
Does Python have a string 'contains' substring method?,3588,python string substring contains
What is the difference between __str__ and __repr__?,3530,python magic-methods repr
Convert bytes to a string,3527,python string python-3.x
How to copy files,3494,python file copy filesystems file-copying
How do I list all files of a directory?,3467,python directory
What is __init__.py for?,3423,python module package python-packaging
How do I sort a dictionary by value?,3416,python sorting dictionary
How can I add new keys to a dictionary?,3411,python dictionary lookup
"""Least Astonishment"" and the Mutable Default Argument",3258,python language-design default-parameters least-astonishment
How do I concatenate two lists in Python?,3245,python list concatenation
How do I select rows from a DataFrame based on column values?,3234,python pandas dataframe
How do I check if a list is empty?,3229,python list
What does ** (double star/asterisk) and * (star/asterisk) do for parameters?,3199,python syntax parameter-passing variadic-functions argument-unpacking
How do I pass a variable by reference?,3180,python reference parameter-passing pass-by-reference
How do I clone a list so that it doesn't change unexpectedly after assignment?,3173,python list reference clone pass-by-value
How do I make a time delay? [duplicate],3134,python delay sleep timedelay
How can I delete a file or folder in Python?,3117,python file-io directory delete-file
What is the difference between Python's list methods append and extend?,3113,python list data-structures append extend
Understanding Python super() with __init__() methods [duplicate],3108,python class oop inheritance super
How to make function decorators and chain them together?,3086,python function decorator python-decorators chain
How do I change the size of figures drawn with Matplotlib?,3063,python pandas matplotlib seaborn figsize
Manually raising (throwing) an exception in Python,3025,python exception
How do I print colored text to the terminal?,2970,python terminal output ansi-colors
How do I split a list into equally-sized chunks?,2961,python list split chunks
How can I access environment variables in Python?,2951,python environment-variables
"Convert string ""Jun 1 2005 1:33PM"" into datetime",2878,python datetime
"Why is ""1000000000000000 in range(1000000000000001)"" so fast in Python 3?",2854,python performance python-3.x range python-internals
Find the current directory and file's directory [duplicate],2849,python directory
Renaming column names in Pandas,2747,python pandas replace dataframe rename
How can I remove a key from a Python dictionary?,2706,python dictionary unset
Check if a given key already exists in a dictionary,2679,python dictionary
How do I parse a string to a float or int?,2668,python parsing floating-point type-conversion integer
How do I get the last element of a list?,2658,python list indexing
How do I sort a list of dictionaries by a value of the dictionary?,2627,python list sorting dictionary data-structures
How to upgrade all Python packages with pip?,2607,python pip
How do I get a substring of a string in Python?,2574,python string substring
How do I lowercase a string in Python?,2473,python string uppercase lowercase
Class (static) variables and methods,2451,python class static class-variables
How to print without a newline or space,2329,python
How to leave/exit/deactivate a Python virtualenv,2314,python virtualenv exit virtualenvwrapper
Calling a function of a module by using its name (a string),2311,python object reflection
Importing files from different folder,2297,python importerror python-import
How do I check if an object has an attribute?,2294,python object attributes
How can I randomly select an item from a list?,2267,python list random
How do I print curly-brace characters in a string while using .format?,2255,python string format string-formatting curly-braces
Limiting floats to two decimal points,2231,python floating-point rounding precision
How do I get the number of elements in a list (length of a list) in Python?,2215,python list
Why is reading lines from stdin much slower in C++ than Python?,2129,python c++ benchmarking iostream getline
How to remove an element from a list by index,2123,python list indexing
Is there a way to run Python on Android?,2085,android python jython ase android-scripting
Determine the type of an object? [duplicate],2081,python dictionary types typeof
How do I count the occurrences of a list item?,2070,python list count
How to determine a Python variable's type?,2070,python types
Delete a column from a Pandas DataFrame,2051,python pandas dataframe
Delete an element from a dictionary,2042,python dictionary del
Why is it string.join(list) instead of list.join(string)?,2034,python string list
How to read a file line-by-line into a list?,2025,python string file readlines
How do I pad a string with zeroes?,1995,python string zero-padding
How to check if the string is empty?,1988,python string comparison-operators
How can I remove a trailing newline?,1967,python newline trailing
How do I append to a file?,1963,python file append
Static methods in Python?,1963,python static-methods
How do I measure elapsed time in Python?,1914,python performance measure timeit
How do I check if a string represents a number (float or int)?,1892,python casting floating-point type-conversion
"What is the difference between venv, pyvenv, pyenv, virtualenv, virtualenvwrapper, pipenv, etc?",1882,python virtualenv virtualenvwrapper pyenv python-venv
Getting the class name of an instance,1867,python introspection instanceof python-datamodel
How do I split the definition of a long string over multiple lines?,1854,python string multiline multilinestring
Meaning of @classmethod and @staticmethod for beginner [duplicate],1852,python oop static-methods class-method
Installing specific package version with pip,1809,python mysql pip pypi mysql-python
Generate random integers between 0 and 9,1798,python random integer
How to prettyprint a JSON file?,1768,python json formatting pretty-print
What's the canonical way to check for type in Python?,1750,python types
Extracting extension from filename in Python,1727,python filenames file-extension
How do I read from stdin?,1719,python stdin
Replacements for switch statement in Python?,1717,python switch-statement
What is the meaning of single and double underscore before an object name?,1715,python oop naming-conventions identifier
How do I get the row count of a Pandas DataFrame?,1713,python pandas dataframe
Proper way to declare custom exceptions in modern Python?,1708,python exception
fatal error: Python.h: No such file or directory,1701,python gcc python-c-api
How do I print to stderr in Python?,1689,python printing stderr
Random string generation with upper case letters and digits,1674,python string random
How do I install pip on macOS or OS X?,1672,python macos pip installation
How can I import a module dynamically given the full path?,1664,python python-import python-module
How can I make a dictionary (dict) from separate lists of keys and values?,1656,python list dictionary
Selecting multiple columns in a Pandas dataframe,1633,python pandas dataframe select
Why do Python classes inherit object?,1618,python class oop object inheritance
How do I profile a Python script?,1617,python performance optimization time-complexity profiling
How can I install packages using pip according to the requirements.txt file from a local directory?,1606,python virtualenv pip
Save plot to image file instead of displaying it using Matplotlib,1606,python matplotlib plot
How do I reverse a string in Python?,1601,python string
How do I write JSON data to a file?,1592,python json
How do I get time of a Python program's execution?,1590,python time execution-time
"What is the Python 3 equivalent of ""python -m SimpleHTTPServer""",1585,python python-3.x httpserver simplehttpserver
Convert integer to string in Python,1555,python string integer
Use different Python version with virtualenv,1549,python virtualenv virtualenvwrapper
How do I get the filename without the extension from a path in Python?,1548,python string path
What does __all__ mean in Python?,1535,python syntax namespaces
Use of *args and **kwargs [duplicate],1532,python args keyword-argument
How can I flush the output of the print function?,1531,python python-3.x printing flush
Creating a singleton in Python,1531,python singleton decorator base-class metaclass
if/else in a list comprehension,1529,python list-comprehension
Create a dictionary with comprehension,1516,python dictionary list-comprehension dictionary-comprehension
How can I check for NaN values?,1504,python math
Why can't Python parse this JSON data? [closed],1504,python json parsing
What are the differences between type() and isinstance()?,1501,python oop inheritance types
Relative imports for the billionth time,1491,python import relative-path python-packaging relative-import
How to change the order of DataFrame columns?,1487,python pandas dataframe
How do I check if directory exists in Python?,1484,python directory
How to put the legend outside the plot,1476,python matplotlib seaborn legend
How can I use threading in Python?,1469,python multithreading concurrency python-multithreading
UnicodeEncodeError: 'ascii' codec can't encode character u'\xa0' in position 20: ordinal not in range(128),1466,python unicode beautifulsoup python-2.x python-unicode
What is setup.py?,1462,python pypi setup.py python-packaging
Relative imports in Python 3,1454,python python-3.x python-import
String formatting: % vs. .format vs. f-string literal,1436,python performance string-formatting f-string
Null object in Python,1427,python object null
How do I check which version of Python is running my script?,1426,python version
Hidden features of Python [closed],1416,python hidden-features
How do I sort a dictionary by key?,1401,python sorting dictionary
"What is the use of ""assert"" in Python?",1401,python exception assert assertion
Is there a built-in function to print all the current properties and values of an object?,1394,python debugging introspection pretty-print python-datamodel
Change column type in pandas,1387,python pandas dataframe types casting
Removing duplicates in lists,1377,python algorithm list duplicates intersection
Best way to convert string to bytes in Python 3?,1377,python string character-encoding python-3.x
How do I create multiline comments in Python?,1371,python comments documentation
"In Python, how do I determine if an object is iterable?",1357,python iterable
How to move a file in Python?,1356,python file file-handling python-os
How do I trim whitespace from a string?,1343,python string trim
How do I get the full path of the current file's directory?,1342,python directory
How to copy a dictionary and only edit the copy,1332,python dictionary reference
How do I terminate a script?,1325,python termination
How to drop rows of Pandas DataFrame whose value in a certain column is NaN,1321,python pandas dataframe nan
How can I do a line break (line continuation) in Python?,1320,python syntax line-breaks long-lines
Getting key with maximum value in dictionary?,1318,python dictionary max
How do I create a constant in Python?,1315,python constants
Display number with leading zeros,1313,python integer string-formatting
How do I find the location of my Python site-packages directory?,1312,python
Correct way to write line to file?,1310,python file-io
pg_config executable not found,1307,python pip psycopg2
Running shell command and capturing the output,1307,python shell subprocess
Create a Pandas Dataframe by appending one row at a time,1302,python pandas dataframe append
Get a list from Pandas DataFrame column headers,1301,python pandas dataframe
Why do people write #!/usr/bin/env python on the first line of a Python script?,1301,python shell shebang
How do I reverse a list or loop over it backwards?,1300,python list
Why does comparing strings using either '==' or 'is' sometimes produce a different result?,1295,python string comparison identity equality
How do I check if a variable exists?,1294,python exception variables
What is the purpose of the `self` parameter? Why is it needed?,1291,python class oop self
How to read a text file into a string variable and strip newlines?,1289,python string
What is the difference between null=True and blank=True in Django?,1288,python django django-models django-admin
How does the @property decorator work in Python?,1285,python properties decorator python-decorators python-internals
How to deal with SettingWithCopyWarning in Pandas,1277,python pandas dataframe chained-assignment
How to add a new column to an existing DataFrame?,1272,python pandas dataframe chained-assignment
"If Python is interpreted, what are .pyc files?",1270,python compiled interpreted-language pyc
What does the 'b' character do in front of a string literal?,1270,python string unicode binary
What is a mixin and why is it useful?,1269,python oop multiple-inheritance mixins python-class
How to catch and print the full exception traceback without halting/exiting the program?,1263,python exception try-catch traceback
Putting a simple if-then-else statement on one line [duplicate],1260,python if-statement syntax ternary-operator
How to get the ASCII value of a character,1257,python ascii
How to make a class JSON serializable,1254,python json serialization
How do I connect to a MySQL Database in Python?,1254,python mysql
How to get line count of a large file cheaply in Python?,1250,python text-files line-count
How does Python's super() work with multiple inheritance?,1250,python multiple-inheritance
How do I print an exception in Python?,1247,python exception error-handling
How do I get file creation and modification date/times?,1239,python file
Count the number of occurrences of a character in a string,1223,python string count
"How to overcome ""datetime.datetime not JSON serializable""?",1221,python json
Does Django scale? [closed],1217,python django web-applications scalability
"Extract file name from path, no matter what the os/path format",1212,python
How to return dictionary keys as a list in Python?,1212,python python-3.x list dictionary python-2.x
Alternatives for returning multiple values from a Python function [closed],1212,python coding-style return return-value
Use a list of values to select rows from a Pandas dataframe,1204,python pandas dataframe
How do I iterate through two lists in parallel?,1194,python list for-loop iterator
How do I trim whitespace?,1194,python string whitespace trim strip
How do I get a list of locally installed Python modules?,1184,python module pip
Fastest way to check if a value exists in a list,1182,python performance list
"Difference between del, remove, and pop on lists",1177,python list
Get difference between two lists with Unique Entries,1176,python performance list set set-difference
"""Large data"" workflows using pandas [closed]",1172,python mongodb pandas hdf5 large-data
Get the data received in a Flask request,1166,python flask werkzeug
Remove all whitespace in a string,1163,python trim removing-whitespace
How do I install a Python package with a .whl file?,1155,python pip python-wheel jpype
Is there a simple way to delete a list element by value?,1152,python list
How do I import other Python files?,1150,python python-import python-module python-packaging
"Should I put #! (shebang) in Python scripts, and what form should it take?",1149,python shell python-3.x shebang
How do you test that a Python function throws an exception?,1147,python unit-testing exception
"What are ""named tuples"" in Python?",1145,python tuples namedtuple
How to parse XML and get instances of a particular node attribute?,1142,python xml
How can I represent an 'Enum' in Python?,1141,python python-3.x enums
What is a cross-platform way to get the home directory?,1140,python cross-platform home-directory
Get unique values from a list in python [duplicate],1139,python list
Usage of __slots__?,1136,python oop python-internals slots
What's the difference between lists and tuples?,1136,python list tuples
Maximum and Minimum values for ints,1135,python integer
How to sort a list of objects based on an attribute of the objects?,1135,python list sorting count
What are the most common Python docstring formats? [closed],1135,python coding-style documentation docstring
Converting from a string to boolean in Python,1116,python string boolean
How to convert list to string [duplicate],1116,python string list
What is the difference between old style and new style classes in Python?,1114,python class oop types new-style-class
Pretty-print an entire Pandas Series / DataFrame,1105,python pandas dataframe
How to print a number using commas as thousands separators,1098,python number-formatting
Checking whether a variable is an integer or not [duplicate],1094,python integer
How to subtract a day from a date?,1090,python datetime date
Convert a String representation of a Dictionary to a dictionary,1089,python string dictionary
Converting unix timestamp string to readable date,1086,python datetime unix-timestamp strftime
Convert list of dictionaries to a pandas DataFrame,1085,python dictionary pandas dataframe
Should I use 'has_key()' or 'in' on Python dicts?,1081,python dictionary
How do I type hint a method with the type of the enclosing class?,1080,python python-3.x pycharm type-hinting python-typing
What is the easiest way to remove all packages installed by pip?,1079,python pip virtualenv python-packaging
How to create a GUID/UUID in Python,1078,python uuid guid uniqueidentifier
How to download a file over HTTP?,1076,python http urllib
How do I check file size in Python?,1064,python file
List comprehension vs. lambda + filter,1061,python list functional-programming filter lambda
How do I remove/delete a folder that is not empty?,1055,python file
How to emulate a do-while loop?,1054,python while-loop do-while
How to concatenate (join) items in a list to a single string,1052,python string list concatenation
How do I unload (reload) a Python module?,1045,python module reload python-import
How to set environment variables in Python?,1044,python environment-variables
Find all files in a directory with extension .txt in Python,1041,python file-io
Find which version of package is installed with pip,1040,python pip
How can I write a `try`/`except` block that catches all exceptions?,1038,python exception
Python's equivalent of && (logical-and) in an if-statement,1027,python
Writing a pandas DataFrame to CSV file,1026,python csv pandas dataframe
What IDE to use for Python? [closed],1025,python ide editor
Why dict.get(key) instead of dict[key]?,1018,python dictionary
How to retrieve a module's path?,1017,python module inotify
What is the difference between pip and conda?,1015,python pip ipython package-managers conda
Behaviour of increment and decrement operators in Python,1013,python operators increment decrement
pip install from git repo branch,1012,python git pip
How to get a function name as a string?,1009,python string function
What is the naming convention in Python for variable and function?,1004,python python-3.x function variables naming-conventions
How do I remove the first item from a list?,1003,python list
How to POST JSON data with Python Requests?,1002,python json python-requests cherrypy
Traverse a list in reverse order in Python [duplicate],998,python loops reverse
How can I make a Python script standalone executable to run without ANY dependency? [duplicate],997,python executable
Importing modules from parent folder,995,python module path directory python-import
mkdir -p functionality in Python [duplicate],992,python path directory-structure mkdir
How to get an absolute file path in Python,992,python path relative-path absolute-path
Multiprocessing vs Threading Python [duplicate],991,python multithreading multiprocessing
What is __pycache__?,989,python python-3.x caching
Peak detection in a 2D array,984,python image-processing
How to check if type of a variable is string? [duplicate],981,python string variables types
Parsing boolean values with argparse,980,python boolean argparse command-line-arguments
How are lambdas useful? [closed],979,python function lambda closures
"How do I remove duplicates from a list, while preserving order?",974,python list duplicates list-comprehension unique
How to use glob() to find files recursively?,972,python path filesystems glob fnmatch
How can I parse a YAML file in Python,970,python yaml
How do I use a decimal step value for range()?,968,python floating-point range
Why use pip over easy_install?,965,python pip setuptools easy-install pypi
"What are the differences between the urllib, urllib2, urllib3 and requests module?",964,python python-requests urllib urllib2 urllib3
Python integer incrementing with ++ [duplicate],963,python syntax increment
How do I determine the size of an object in Python?,962,python object memory memory-management sizeof
How do I check the versions of Python modules?,959,python
What do __init__ and self do in Python? [duplicate],958,python oop self
Python `if x is not None` or `if not x is None`? [closed],956,python coding-style nonetype boolean-expression pep8
Reverse / invert a dictionary mapping,955,python dictionary mapping reverse
Automatically create requirements.txt,953,python dependencies python-import requirements.txt
How do I convert a datetime to date?,947,python datetime
Running unittest with typical test directory structure,946,python unit-testing
Is there a list of Pytz Timezones?,945,python django pytz
Is there any way to kill a Thread?,941,python multithreading python-multithreading kill terminate
Convert hex string to integer in Python,940,python string hex
How to make IPython notebook matplotlib plot inline,936,python matplotlib jupyter-notebook ipython data-visualization
How to remove items from a list while iterating?,933,python iteration
pip install mysql-python fails with EnvironmentError: mysql_config not found,932,python pip mysql-python
How do I expand the output display to see more columns of a Pandas DataFrame?,919,python pandas printing column-width
How do I detect whether a variable is a function?,919,python
UnicodeDecodeError: 'charmap' codec can't decode byte X in position Y: character maps to <undefined>,918,python python-3.x unicode file-io decode
How do I do a not equal in Django queryset filtering?,917,python django django-models django-queryset
Remove empty strings from a list of strings,916,python string list
"Writing a list to a file with Python, with newlines",914,python file list file-io newline
Deleting DataFrame row in Pandas based on column value,914,python pandas dataframe performance delete-row
How to properly ignore exceptions,914,python exception try-except
What is the best project structure for a Python application? [closed],913,python directory-structure organization project-structure
"What is a clean ""pythonic"" way to implement multiple constructors?",912,python class constructor
python setup.py uninstall,912,python setup.py pypi
List comprehension vs map,911,python list-comprehension map-function
How do you get the logical xor of two variables in Python?,910,python logical-operators
Why does Python code run faster in a function?,910,python performance profiling benchmarking cpython
Get key by value in dictionary,908,python dictionary
Convert date to datetime in Python,905,python datetime date
What does functools.wraps do?,900,python decorator functools
Shuffling a list of objects,898,python list random shuffle
List of lists changes reflected across sublists unexpectedly,898,python list nested-lists mutable
Combine two columns of text in pandas dataframe,891,python pandas dataframe
What does -> mean in Python function definitions?,887,python python-3.x annotations function-definition
How to import the class within the same directory or sub directory?,886,python python-import
open() in Python does not create a file if it doesn't exist,886,python linux file-io file-permissions
"What is __future__ in Python used for and how/when to use it, and how it works",883,python python-2.x
How to identify which OS Python is running on?,880,python operating-system cross-platform platform-agnostic
Getting a list of all subdirectories in the current directory,880,python directory subdirectory
How are iloc and loc different?,878,python pandas dataframe indexing pandas-loc
not None test in Python [duplicate],878,python nonetype
